id,sentence
1943,Под впечатлением от симфонии я захотел больше узнать о создателе.
1944,Не утопия ли это?
1945,Каждый человек поступил бы так при подобных обстоятельствах.
1946,Ни одной пули в меня не попало.
1947,Я нигде не встречал такого безразличия.
1948,"Здесь ещё осталось несколько ветхих деревянных домишек былых, запущенных деревень."
1949,В своем романе он описывает андерграунд.
1950,Я слышу хрип звонка.
1951,"Среди сотрудников нашего института есть такие, которые отдыхали на юге."
1952,Он долго был в отчаянии.
1953,Вдова у Ивана Ивановича живет в Горьком.
1954,"Он рассмотрел случаи, являющиеся особенно трудными."
1955,Она сделала печальное лицо.
1956,Новых пассажиров в купе не появилось.
1957,Без веры прекращает жизнь человеческие эмоции.
1958,"Я прожил неделю и, несмотря на то, что не было там у меня ни одного знакомого человека, провел время чрезвычайно весело."
1959,Нельзя же пропадать нечем.
1960,"Главное, на чём следует сосредоточиться и разобраться при разработке плана проекта, — это возможные риски."
1961,Разницы между ними не усматривается.
1962,"Ему казалось то, что ещё не всё потеряно и что успеть в срок возможно."
1963,Вы когда-нибудь пили такое вино?
1964,"Я замечал человека, который переплыл Ламанш."
1965,Они читали жалобы на себя.
1966,Искусственные алмазы лучше поддаются ювелирной обработке из-за отсутствия природных примесей и прочной кристаллической структуры.
1967,Он не был там ни разу.
1968,Как я смогу получить эти книги?
1969,"Я спросил у него, зачем только он туда ходил."
1970,"Они подвинулись, и я получил место рядом с ними."
1971,И все то время суетились как пчелы.
1972,"Закончив самостоятельную работу, тетради были сданы учителю."
1973,Дорожные службы отчитались о доходах: деньги ушли в около десяти километров дороги.
1974,"У меня есть Мария, а у нее есть я."
1975,"Тут на дороге показался я, и он спрятался в кусты."
1976,Здесь мы сталкиваемся с совершенно новой проблемой.
1977,"В конце XVII столетия науке стало известно о существовании необычного млекопитающего, откладывающем яйца и насиживающем их: это был утконос."
1978,"Я спросил у прохожего о том, что есть ли поблизости какая-нибудь станция метро."
1979,"Такое гнездо строится животными не только для себя, но и для других членов группы."
1980,Термическая обработка дает металлам исключительную твердость.
1981,Евгений Базаров похоронен в этой могиле.
1982,Мы обращаем внимание на некоторые их письма.
1983,Он совершенно спокойно принял возражения своего оппонента.
1984,"Ум мой бессознательно отказывался выводить какие-либо заключения из того, что я видел."
1985,Бурмин был в самом деле очень милый молодой человек.
1986,Врач лечит Ивана от малярии хинином.
1987,Конец весла задел подол ее платья.
1988,"Он увидел телегу и понял, что она сломана и после починена."
1989,Петя стучал в окно.
1990,Ему чужды какие-либо колебания.
1991,На улицах считалось пустым.
1992,"Этот зонтик был у какой-то дамы, я видел ее вместе с Куколевым накануне его убийства, но лица не рассмотрел."
1993,"Докладчик заострил внимание на вопросе, что нередко поднимается на подобных собраниях."
1994,"Употребляя букву «ъ» на конце слов, в XIX веке это была лишь дань традиции."
1995,"Однако, слава Богу, обморок не имел последствий."
1996,Потому что у меня слов не находится.
1997,У воды есть кислород.
1998,Попробуй заметить вон ту звездочку над самой горой.
1999,Иван начал пилить дрова.
2000,"Перейдя через площадь, он вошел в кафе, заказал напиток, привстал, чтобы вынуть из-под себя свою же задавленную шляпу."
2001,"Потому что ты опять стала отдаляться от меня, опять желаешь нравиться, принимать мужские восторги."
2002,"У нее есть способности, но способным человеком в целом ее не назовешь."
2003,Эта церковь всегда стояла на холме.
2004,"Книга, что была на полке."
2005,"Сквозь каменное выражение лица на секунду промелькнула робкая улыбка, и Евгений Иванович вопросительно посмотрел на Машеньку."
2006,"Ты тогда сказала, что наверное уезжаешь в Италию."
2007,Он не моется уже неделю.
2008,Я так и не узнал конца этой истории.
2009,"Иван прилег, чтобы отдохнул."
2010,"Крайнюю ступень в ряду фразеологических сочетаний занимают обороты, включающие слова с единичным употреблением."
2011,Меня не было дома.
2012,"Аудитория, особенно выступавшие с докладами, одобрили проект резолюции конференции."
2013,"Я пригласила ее, чтобы не быть одной."
2014,Я не брала ключи.
2015,Я не стирала полотенца.
2016,Иван Грозный не убил своего сына.
2017,Я обнаружил его лежащего одного на кровати.
2018,Сергей вешал тогда эту карту.
2019,"Кто бы ни изучали историю русского флота, все восхищались блестящим военным искусством адмирала Фёдора Ушакова."
2020,Бери что-нибудь с собой.
2021,Дорогие он видел машины.
2022,Мальчик высунулся из окна.
2023,Ты еще не взял белье из прачечной?
2024,Они грелись возле костров.
2025,Пожарная команда не появилась.
2026,Напоминание себе об опасности прозвучало вовремя.
2027,Он присутствовал на дуэли в качестве врача.
2028,Ребенок уже не спит.
2029,Около стола стояло большое кресло.
2030,Его приняли в институт.
2031,"Кроме того, цветки липы активно посещают шмели и другие насекомые."
2032,Я содрогнулся от этой мысли.
2033,Баран пропал по вине пастухов.
2034,Неужели вы не в состоянии оградить меня от оскорблений?
2035,"Не думаю, чтобы мосты уже сняли."
2036,Лишь бы дождь опять не начался.
2037,"В случае если не оказать своевременно медицинскую помощь, многие болезни являются смертельно опасными."
2038,"Все, кто рано начинает учить иностранный язык, овладевает им в совершенстве."
2039,"Это произведение Василя Быкова я прочитал летом, посвященное Великой Отечественной войне."
2040,"Ашот лежал поодаль от меня, спал."
2041,Это обозначило мне границы.
2042,"Мы, к сожалению, знаем, что Наталья Николаевна справилась со своим заданием."
2043,У меня есть для этого дача.
2044,"Напротив, здесь жил дух свободы, и это чувствовалось всеми."
2045,Он придал вазе какую-то причудливую форму.
2046,"Возьми из сада мою кофту, я оставила ее в беседке."
2047,Он взял на себя управление имением.
2048,Соли у нас нет.
2049,Отец и дед Тетюева служил управителями в Кукарском заводе и прославились в тёмные времена крепостного права особенной жестокостью по отношению к рабочим.
2050,"Один из выпускников зашёл как-то в свой интернат, заодно и с Сергеем Льнявиным перекинулись парой слов."
2051,Что сегодня получил Саша?
2052,"Оба вымокнув под дождем, они добежали до станции."
2053,Влагой и весенней прелостью пахло у ручейка.
2054,Эти студенты — сами хорошо знающие эскимосский язык.
2055,Вопреки рекомендаций врачей спортсмен не снижал нагрузки во время тренировок.
2056,"Не думаю, чтобы в тот момент я ее жалела."
2057,Как он ее в этот момент ненавидел.
2058,К этому времени пирог был уже испечен.
2059,Она вдруг запнулась и долго смотрит непонимающими глазами на Елену Николаевну.
2060,Стока талых вод не наблюдалось.
2061,Я варю вам борща.
2062,"Я уверен, что возмутительное сообщение ТАСС о митинге 4 февраля кто-то и где-то редактировал."
2063,Реорганизации не было проведено.
2064,По окончанию гимназии Фонвизин стал учиться на философском факультете университета.
2065,С этим ушибом каждый врач справится.
2066,Я совершенно убеждён: каждый из двух братьев велики в своём актёрском мастерстве!
2067,"Ральф считает, что человек в желтой шляпе шпион."
2068,"Отсутствует, чтобы не видеть."
2069,"Он всегда говорил очень убедительно, а у меня возникали некоторые сомнения."
2070,Биссектриса угла при вершине всякого равнобедренного треугольника является осью симметрии.
2071,"Если все они могут это сделать, то зачем приглашать какого-то знаменитого специалиста."
2072,У Маши сын пошел в школу.
2073,"Что ты не знаешь, как починить?"
2074,Маша внимательно читает книгу.
2075,"Все, кто пообещал прийти на презентацию книги, сдержал слово."
2076,"Была в ней и скромность, и изящество, и достоинство."
2077,Пуля пробила дырку в фуражке.
2078,"Мальчик, ушедший было вперед, медленно возвращался к Арсению."
2079,Полковник отдал майору приказ солдатам выдвигаться на позицию.
2080,Меня огорчил его отказ.
2081,А зачем Вы завязывали ногу?
2082,Лесистая гора привлекла внимание туристов.
2083,"Химики, физики, математики, биологи работают вместе понять, что же происходит в природной среде. ."
2084,Митя повязал платок на шею.
2085,Он не развлекает меня своими анекдотами.
2086,"Трудно себе представить, чтобы власть так легко отказалась от использования СМИ в своих целях."
2087,Этот реальный мир сейчас не существовал для нее.
2088,"Я думаю, что ты несомненно прав."
2089,По всей колючей проволоке необходимо пустить электрический ток.
2090,Мне этого заранее не сказали.
2091,Новых сотрудников не принято.
2092,На правой ладони отсутствовали всякие признаки ожога.
2093,"Я надеюсь на Машу больше, чем Петя."
2094,Это ты верно заметил.
2095,"Если Иван заболел, он пойдет к врачу."
2096,Иван отменил решение пойти на встречу одному.
2097,Она часто о чем-то мечтает.
2098,"Я сожалею, что никогда я на Камчатке не был."
2099,"Я не думал ― думать мне не хотелось ― но с удовольствием разглядывал Алика, Толика, Петьку, Демьяна, будто видел их всех впервые."
2100,Вчера в два часа дня иду я по Кузнецкому.
2101,"Он прощается с героиней и бежит к вагону, потому что поезд тронулся."
2102,Охранник стоял сбоку от президента.
2103,За прилавком стоял продавец.
2104,Ничего этого я не знал.
2105,Директор принимает по средам.
2106,"Он почувствовал, что его определенно кто-то догоняет."
2107,Я говорю с Машей.
2108,Какую ты купил машину?
2109,Некоторые из моих студентов способные.
2110,В мае в Москве проходит книжная ярмарка.
2111,Он мне за то поплатится!
2112,Она всегда душится какими-нибудь необыкновенными духами.
2113,"Но когда он начинал что-нибудь делать, он совершенно преображался."
2114,"Готлиб не мог не помнить о незавидной судьбе многих своих предшественников, томящимся теперь в городских подземельях."
2115,В 6.30 пирог был испечен.
2116,Студент купил книгу у букиниста.
2117,"Вот теплятся желтые свечи, забытые в окне человека."
2118,"Среди домов, построенным на этой улице, было несколько многоэтажных."
2119,Этот человек действительно реальное лицо только в твоей фантазии.
2120,Я увидел там одни развалины.
2121,"Гость вошел в калитку, находившуюся около входа в лавку, и попал в квадратный небольшой дворик."
2122,Я о тебе тогда вспоминала.
2123,Новый информационный ресурс набирает популярность.
2124,Его шерсть имеет красивый оттенок.
2125,У носа была большая бородавка.
2126,"Люби меня, детка, пока я на воле."
2127,Незнайка ударил его палкой по спине.
2128,"Толстой очень хорошо понимал то, что своей «Исповедью» наживёт себе врагов, в том числе и среди священников."
2129,Отказ от игры уронил Фишера в глазах шахматистов.
2130,Ее сестра звалась Татьяна.
2131,Решимость Джона нас удивила.
2132,"Посему мы не сомневаемся, что именно в этом и начала состоять наша главная задача."
2133,"Ему дают 1/4 фунта хлеба (на него и жену, и то не каждый день! ), за которым он должен идти больной за две версты."
2134,Вблизи стоял большой каменный дом.
2135,"Окончив сбор лекарственных трав, не забудьте тщательно отряхнуть одежду и вымыть руки с мылом."
2136,Однажды он был встречен ею принаряженным.
2137,"Христофоров, явившийся в ложу первым и одиноко сидевший за ее красно-бархатного барьером, чувствовал себя затерянным в огромной, разодетой толпе."
2138,На каждой дорожке бежало по спортсмену.
2139,Он ищет новую секретаршу.
2140,В этом ущелье с июля по октябрь геологи искали алмазы.
2141,"Я не думаю, погода изменится."
2142,Зачем ты взяла чужую бумагу и отдала ему?
2143,Любви все возраста покорны.
2144,Я был огорчен этой новостью.
2145,"Если кто-то из них вдруг придет, я буду рада."
2146,Он отдал крестьянам землю.
2147,Она родила ребенка от иностранца.
2148,Я поздоровался с ней первой.
2149,Перед домом есть колодец.
2150,"Вопреки прогнозов специалистов, уровень безработицы за минувший год существенно снизился."
2151,"Угадай, что мы тебе подарим."
2152,Лягушки кишат в болоте.
2153,Разве ты не бываешь там каждый день?
2154,Около тополя стояла Даша и смотрела на него.
2155,Гегель определяет свободу как познанную необходимость.
2156,"Я подозреваю, что его обманывают."
2157,"Повторяю, я продолжал работать в неутвержденном качестве заведующего отделом еще четыре года, пока не написал статью."
2158,"Мне сказали, что он женат на одной полячке."
2159,Должен же он был там что-нибудь делать.
2160,"Если ты воспользуешься любым из этих средств, ты мгновенно поправишься."
2161,Ребенок спит днем два часа.
2162,МГУ отпраздновало свой юбилей.
2163,"Иван жалеет, что уехал."
2164,Она сидела рядом со мной и горько плакала.
2165,Поздравляю с днём рождением и желаю долгих лет жизни!
2166,Вход в пещеру завалили камни.
2167,Первое же сражение обнаружило его отчаянную храбрость.
2168,Мы первыми научились видеть дальше собственного порога и думать шире родимой околицы.
2169,Он сел рядом с ней и стал ей что-то оживленно говорить.
2170,Волосы у затылка собраны в пучок.
2171,Первые механические часы появились в 14 веке.
2172,"Только какой-то негоциант, живший рядом с приютом и потерявший счет деньгам, ежегодно при получении из-за границы транспорта с фруктами присылал в приют ящик апельсинов."
2173,Учеников не выступало на концерте.
2174,"Гость вошел в калитку, находившуюся рядом со входом в лавку, и попал в квадратный небольшой дворик."
2175,Я не мог понять причину его враждебных взглядов и в целом неприязненного отношения ко мне.
2176,"Он не раз упрекал меня за то, что я не имею дачи на побережье, так как там, по его словам, настоящий рай."
2177,Все мои друзья перебывали на выставке.
2178,Это письмо от обвиняемого кому-то.
2179,Память ему начисто отшибло у меня.
2180,"Но лучше всего было лицо — аскетически худое, со страдальческими морщинками возле губ, со втянутыми щеками, запавшими висками, очень трагический профиль."
2181,"Ему прислали телескоп, чтобы наблюдать затмения."
2182,Старые обычаи еще сохранились.
2183,Статья была всё-таки опубликована вопреки мнения журналиста.
2184,Свечка погорела и погасла.
2185,Он неделю не умывался.
2186,Ты послал ей приглашение на свадьбу?
2187,Необходимая принадлежность многих игр — это игральный кубик.
2188,"И вдруг после первых, ничего не предвещавших фраз эта скрытная, необщительная женщина нервно открыла нараспашку свою душу."
2189,Ему не до разговоров.
2190,"У тебя есть молодость, красота, здоровье."
2191,"Особенно полюбились сказки, рассказывать которые она была мастерица."
2192,"Вообще-то у него есть эта книга, но сейчас он ее отдал."
2193,"Вспоминаю выступление фронтовой концертной бригады, состоящее из артистов Мурманского драмтеатра."
2194,Его убили около «Трех утопленников».
2195,Дверь плохо открылась.
2196,"Я чувствую, мне, кажется, придется уступить."
2197,В четверг я поеду и вернусь к ней.
2198,Возьми из моего стола тезисы докладов и дай Ивану Сергеевичу.
2199,У деревни пасется стадо коров.
2200,У нас сейчас урок.
2201,"У него очень хорошее место, он работает главным инженером одного экспериментального завода."
2202,"Он ясно понимал, что сейчас от него требовалось."
