id,sentence
3901,Он не опозорил семью женитьбой на служанке.
3902,Я на это смотрю просто.
3903,"Задача, следовательно, заключается в том, чтобы народные композиторы развивали музыку реалистическую, а антинародные композиторы прекратили бы свое более чем сомнительное экспериментирование в области музыки формалистической."
3904,"Снижение добавки эфирной «головки» до 2% восполняется добавкой кубового остатка до 3%, что в сумме составит не менее 5%."
3905,"Я не позвонил потому, что хотел увидеть ее."
3906,"Ему казалось, что около самого его уха непрерывно ревет сирена, и этот звук был для него непереносим."
3907,Я возмутился на него за грубость.
3908,Мне все-таки удалось получить место в мягком вагоне.
3909,Он часто проводил такие эксперименты вместе с кем-нибудь из своих сотрудников.
3910,Кто что сегодня купил?
3911,Тут он встает и идет к двери.
3912,Такая мысль не возникает неожиданно.
3913,Он отказался от какой-либо помощи.
3914,Напрасно ты не приехал.
3915,"Она с грустью сказала, что у нее еще нет модных сапогов на предстоящую осень."
3916,Последующие события подтвердили мне его правоту.
3917,"То, что она рассказала, не дает поводов для оптимизма."
3918,Я никогда не считал и не считаю Коминтерн безгрешным.
3919,"Поодаль где-то была лужа, и, вероятно, это туда с высоты огромных деревьев поочередно сучья роняли капли."
3920,"Фома сунул руки глубоко в карманы брюк, а грудь выпятил вперед, отчего вся его фигура сразу приняла явно вызывающий вид."
3921,Маша сидела поодаль от мужа и читала.
3922,Врач советует Тане не менять климат.
3923,"Да и сам директор обладал, как говорят, «деляческим» подходом и видением проблем."
3924,Дерево у корней заросло мхом.
3925,Я гулял уже полчаса.
3926,Близ него построен домик с красной крышей.
3927,"Когда я вернулся, он спал."
3928,В офисе компании нам предоставили всю необходимую информацию.
3929,"Брат сидел около меня, а муж — сзади."
3930,"Это, но никто не отозвался."
3931,Хозяйки в доме не чувствуется.
3932,"Зине кажется, что черта с два он придет."
3933,"Этот прибор может принести много пользы, если работая правильно."
3934,"Новые катера и водометы-толкачи гудят коротко, высоко и гнусаво."
3935,Он затормозил не резко.
3936,Эмпирическая психология должна быть вне какой-либо философии.
3937,"Он рассмотрел случаи, считающиеся особенно трудными."
3938,Она покупает несколько квартир.
3939,"Иван не знает, что она приехала."
3940,"Он думает, что все люди по природе добры."
3941,"Зверь осторожно пробирался по дороге, ведущей к деревне и по которой он ходил уже не раз."
3942,Государь император под обаянием личности А. Д. Протопопова назначил его на пост министра внутренних дел.
3943,"Довольно большой здание было украшено какими-то башенками и балкончиками, которые искусно вписывались в общий ансамбль."
3944,"Заключив годовой контракт, команда, которой, по условиям договора, предстояло дать более 60 концертов в разных городах нашей страны, начали напряжённо готовиться к туру."
3945,Окно разбилось от порыва ветра.
3946,Новый проект не удивил нас какими-либо интересными деталями.
3947,Группа учащихся школы искусств приняли участие в открытии детской картинной галерее.
3948,"Тем, кто играют на фортепьяно, известны имена великих пианистов."
3949,На горизонте белеют паруса.
3950,Это было вовремя сказанное слово.
3951,"Отвечая ей небрежно, ты рискуешь потерять ее доверие."
3952,У него есть место на «Лебединое озеро».
3953,Я провожу вечера у радио.
3954,"Обращаясь к творчеству М. А. Булгакова, осознаёшь, что до какой степени велик его вклад в нашу литературу."
3955,"Я думаю, что он этого не сделает."
3956,"Передайте ей, что Иван, может быть, приедет."
3957,"Важно спросить себя ни вокруг чего устроена ваша жизнь, а вокруг кого."
3958,"Мне кажется, важнее быть честным человеком, нежели чем хорошим работником."
3959,"Только если мне вернут половину денег за билет, так я скажу, что это замечательный концерт!"
3960,Коля не находил своего ключа.
3961,"Со дня, когда они расстались, прошло сорок пять лет."
3962,Я не был дома.
3963,Единственным утешением и отрадой Алёны были облегчавшие слёзы её измученное сердце.
3964,"И право, так мало делается этим кому-то зла, а себе столько удовольствия."
3965,От страшного потрясения и побоев царевич Иван слег и скоро умер.
3966,Вода наполняет бассейн до краев.
3967,Оркестр расположен вблизи сцены.
3968,"Трое вакуумщиков действительно ходили как пленные звери рядом со своими насосами — у них был срочный заказ, и их уже вторые сутки не пускали спать."
3969,Каждый день я поливал и любовался этими необычными цветами.
3970,"Автор рассказал об изменениях в книге, готовящейся им к переизданию."
3971,Мы пойдем до поворота.
3972,Патриарх берет на себя всю вину за составление и рассылку воззвания.
3973,Я одобрил Петино решение уехать.
3974,"Я вижу, разговор оживляется."
3975,"Они зайдут, а ты спрячешься."
3976,Газета «Московский комсомолец» опубликовал статью известного кинокритика.
3977,Ты сегодня покупал кожаную куртку?
3978,"Можно сказать, что мозг людей стал стареть медленнее благодаря многообразной информационной среды."
3979,Девочка хочет мать купить ей куклу.
3980,"Появится кто-нибудь совершенно новый, неведомый, порожденный нынешней ситуацией, ни на что ожидаемое не похожий."
3981,"Читая стихотворение, чувствуются переживания автора."
3982,У меня нет мобильника.
3983,Удачное употребление дает глубокое значение народным изречениям.
3984,После этого он утратил весь интерес к происходящему.
3985,Всю ответственность я принимаю на себя.
3986,У этой комнаты пять метров в ширину.
3987,"Студенты, оба знатоки эскимосского языка, не смогли разобрать здесь ни слова."
3988,Он готов умереть за тебя.
3989,"В пять часов утра, как всегда, пробило подъём — молотком об рельс у штабного барака."
3990,"И Иван, я поступил в институт, очень обрадовался."
3991,"Порой люди рассуждают, что как прекрасна была бы цивилизация, основанная не на обладании материальными ценностями, а на заботе о других."
3992,Преподаватель французского языка объясняет правило согласования по роду.
3993,"Ей слишком нездоровилось, чтобы принимать гостей."
3994,Цыганка звенела серебряными браслетами.
3995,Руководство определило жёсткие сроки для реализации проекта.
3996,Вблизи него был построен и перерабатывающий завод.
3997,"Однако космонавты испытывают состояние невесомости, так как они как бы все время падают на Землю, но промахиваются."
3998,Я велела Верочке идти домой.
3999,В детстве особенно важно научиться любить природу и понять её красоту и тайну.
4000,Туда идти было поблизости.
4001,"Рассказывали про Виргинского, что супруга его, не пробыв с ним и году в законном браке, вдруг объявила ему, что он отставлен."
4002,Ни в одном номере телевизора не стояло.
4003,"Раздражительность — это склонность несоразмерно реагировать на обыденные раздражители, выражая в словах и поступках недовольство и неприязнь к окружающим."
4004,Надо принимать строго и серьезно эту страшную необходимость.
4005,"Завернувшись в плед, мне стало тепло и уютно, озноб прекратился, так что очень скоро я заснул крепким, целебным сном."
4006,Его обувь нужно отремонтировать.
4007,Двор около дома засыпан был гравием.
4008,Я их однажды на Фонтанку подвозил.
4009,Он рассадил полсотни людей в профессорской гостиной.
4010,Телевизор не был в мастерской два года.
4011,Она нас очень хорошо принимала.
4012,Кирила Петрович решился не тратить времени и назначил быть свадьбе.
4013,"Он рассказал мне замысел поэмы, которую, вероятно, хотел, чтобы я прямо по замыслу, без текста перевел."
4014,"Школьники нашего села охотно помогали группе археологов, приехавшим из Новгорода."
4015,"Рассуждали они о том, что одиночество весьма продуктивно в художественном отношении."
4016,Как бы он не надел второпях мою шляпу.
4017,"Не скажу, чтобы он мне так уж нравился."
4018,Всякий молоток найдется.
4019,Она приняла ребенка на плечи.
4020,На дороге показался всадник.
4021,Потом дорога входит в леВскоре она выходит к реке.
4022,"Медсестра Люся из поликлиники, делавшая ему уколы, тоже была бодра и в меру улыбчива."
4023,Большинство теоретиков отвергли этот аргумент.
4024,Его статью приняли в журнал «Филологические науки».
4025,М. Ю. Лермонтов писал романтические поэмы.
4026,Всю ночь налимы не могли уснуть и лениво шевелились в садке.
4027,Каждому ребенку досталось по конфете.
4028,"Фигурки шахмат были костяными, очень дорогими, то ли из слоновой кости, то ли из самого мамонта, и Костя очень дорожил ими."
4029,"Это была лекция из чего-нибудь вроде мотивационной книги, основная мысль которой поверить себя и идти к цели."
4030,В сознании его снова и снова возникали глуховатый колодезник и дорога –– зимняя и лунная.
4031,Балка не упирается в стену.
4032,Повествование начинается с 19 июня 1941 года.
4033,"День был дождливый, а Коля не взял зонт."
4034,"Я уверен, что он возможно прав."
4035,На подоконнике недалеко от двери сидела молодая красивая девушка и курила.
4036,"На собрании группы обсуждались вопросы посещаемости и то, что нет ли возможности досрочно сдать зачёты."
4037,Закройте номер и возвращайтесь!
4038,Похвалы в честь любимого издательства из уст ребятишек.
4039,Ребятишки ползают по двору и роются в песке.
4040,"Ему не хотелось ехать с ней, оттого, что она вновь стала отстраненной."
4041,Он дал очень какой-то ответ.
4042,Специалисты связывают понижение курса и падение индексов.
4043,Иван прилетел на свадьбу дочери.
4044,"В одном из старинных храмов города, сохранившимся до наших дней, под слоем краски обнаружены древние фрески."
4045,"Да его никто и не слушал, потому что Старшов смотрел на Олексина-старшего, а тот мучительно преодолевал неимоверно разросшуюся застенчивость."
4046,"Я не забыл, что у нее сегодня день рожденья."
4047,Они читали статьи Петра друг о друге.
4048,Эти студенты — сами сведущие в эскимосском языке.
4049,Этого процесса никто не видел.
4050,Здесь есть прехорошенькие женщины.
4051,Иван не прилетел на свадьбу дочери.
4052,"Он существовал, и между прочим существовал он неплохо."
4053,Виктор Ерофеев выразил желание выступать второй.
4054,Некоторые сотрудники нашего института отдыхали на юге.
4055,Павел Петрович восседал между Катей и Фенечкой; мужья пристроились возле своих жен.
4056,Все хлопоты он взял на себя.
4057,Она была в стороне от всяких интриг.
4058,Они помнили его талантливыми.
4059,"Те, кто придут позже, займут свободные места."
4060,"Все-таки я считаю, вина Бухарина не доказана."
4061,Этот плохо был очень тяжелым.
4062,И опять весь вечер мы говорили о чем-нибудь постороннем.
4063,Величественный горный пейзаж вызывал восхищение.
4064,Всю неделю мечтала об отпуске.
4065,У меня вставили зубы.
4066,"Соломон Волков хочет насильно выпустить книгу о Бродском, а тот грозит ему судом."
4067,"Может быть, с досады, что я, по эгоизму, не достал билета на спектакль в прошлый понедельник?"
4068,"Главною его слабостью была страсть к прекрасному полу; не редко за свои нежности получал он толчки, от которых охал по целым суткам."
4069,"Подбежала собака, обнюхала чемодан и стала тереться боком о деревянный столб."
4070,Броненосец скрежетал якорными канатами.
4071,"При ознакомлении с трудом взрослых у детей пробуждается чувство уважения к их труду, бережное отношение к результату труда, желание быть похожему на этого человека."
4072,"Скажи, а нельзя постараться, чтобы Сухой Рыбак не обидел Ваню?"
4073,Это не связано с какими-либо конкретными задачами.
4074,"И каждый раз, когда раздавался любой звук, старуха вздрагивала."
4075,"Один из них, тщедушный и сгорбленный старичок с седою бородою, не имел в себе ничего замечательного, кроме голубой ленты, надетой через плечо по серому армяку."
4076,"Увидал, что у санитара нет сапогов ― велел дать."
4077,"Тот, кто пришёл на репетицию вовремя, успели выбрать костюмы по своему вкусу."
4078,Никто из нас не ожидал такого холодного и даже враждебного приёма.
4079,Мне было легко верить кому-нибудь из них.
4080,Чудовища оказались каждое на своем месте.
4081,"Она съездит на дачу, а потом ― работа и жизнь."
4082,"Это была либо моя мать, либо сестра."
4083,Он прочел две книги.
4084,Технология выращивания клубники имеет свои особенности.
4085,Дело слушалось окружным судом Тель-Авива 12 мая 1998 года.
4086,Пастух играл на свирели.
4087,"Вождь хочет говорить, причем среди вас есть тот, с кем он хочет говорить."
4088,"Я по себе знал: когда что-то не выходит, все сделаешь для того, что бы вышло, так просто не отступишься."
4089,Какой странной показалась мне его просьба.
4090,"Иван пришел на спектакль, несмотря на головную боль?"
4091,"Раза три ездоки выравнивались, но каждый раз высовывалась чья-нибудь лошадь, и нужно было заезжать сначала."
4092,"Лоси обычно ведут себя очень тихо и боятся людей, однако они могут стать очень агрессивными, наевшись перебродивших яблок."
4093,Приказ был отдан отступать солдатам командиром.
4094,"Специалисты съехались со всех концов страны, с других трубных заводов, и живут без них."
4095,Вскоре он уедет из Москвы.
4096,Дома возникли из тумана.
4097,"У многих видов растений и животных пол зависит от обстоятельств среды: например, у рыб сибасов смена пола у взрослых особей могут происходить под действием температуры."
4098,"Мне послышалось, будто он между слов, в разговоре обещал помочь семенною картошкой."
4099,"Кто писал ""Войну и мир""?"
4100,"Он дал мне, наконец, передышку."
4101,"Маша не знала, что Иван улетел в Марокко."
4102,"Егорова расстраивало не столько всё происходящее, сколько настораживало."
4103,"Она воскликнула, что ах, то был только сон."
4104,Пойду к маме и возьму у нее десять рублей.
4105,"Я хочу знать, берете ли вы эти деньги."
4106,Множество людей пришло за кулисы.
4107,"Собака уже несколько часов стояла рядом с облупившейся, грязной стеной, ожидая своего хозяина."
4108,Я резал мясо тупым ножом.
4109,"Он вспоминал, что ее зовут Татьяна."
4110,Инвалид-гардеробщик за деревянным барьером пил чай из термоса.
4111,Поскольку еще один такой выкрик и его выгонят.
4112,"Иван, кажется, чем-то расстроен."
4113,"По-видимому, он доехал быстрее, чем думал, вследствие того что, когда я спустился во двор, на скамейке под липой уже маячила тёмная фигура. ."
4114,Он пролил клумбу водой из лейки.
4115,Крепостные валы еще сохранились.
4116,"Я обратил внимание, в чем ошибка."
4117,Там были расстреляны палачами.
4118,"После окончания школы, он принял решение пойти работать на завод, и задумался: ""Пойти на завод кем?"""
4119,"Такой человек, если его обидят, то не стерпит."
4120,Добрые люди существуют всегда.
4121,"Приверженцы фэншуй верят, то что можно создать гармонию в жизненном пространстве, управляя потоками энергии."
4122,"Явился Родион с тем, что он называл фриштык."
4123,"Вероятно, тебе больно идти."
4124,Все видели желание власти уйти от всякой ответственности.
4125,Кошка не ест ветчины.
4126,Кто-то бродит по ночам возле нашего дома.
4127,Я жду тебя с двух до трех.
4128,"Я думаю, он согласится."
4129,"Одни ученые утверждают, что эти игры вредны, другие что полезны."
4130,"Он знает, что волки опасны."
4131,Машина выезжала из гаража.
