id,sentence
5799,"Она стояла так близко, что я ощущала запах ее духов."
5800,Окно было открыто час назад пятнадцать минут.
5801,Ты хоть раз вешал эту карту?
5802,"Тут к нему подошёл боец без погонов, назвавшийся старшиной Огрызковым, который, по-видимому, уже имел какой-то парашютный опыт."
5803,Приход Пети объясняет отсутствие Вани.
5804,"Пожалуй, стоит изменить место встречи вокзал."
5805,Я не смог уговорить никого из них.
5806,Перемен в технической политике фирмы еще не наступило.
5807,Лена пообещала больше не ездить туда одна.
5808,"Косуля—очень пугливое животное, и встретить его удается очень редко."
5809,Весь вечер я волновалась.
5810,У Пешковского обсуждается проблема залога.
5811,Я имею деньги в кармане.
5812,"Надо, чтобы жена принесла свое, а муж — свое."
5813,Она живет в маленьком городе близ Курска.
5814,"Нельзя не любить того, кто обладает такими достоинствами."
5815,Я не читал твою статью.
5816,Развал лаборатории –– не его вина.
5817,"Этот игрок был куплен «Реалом», чтобы играл на правом фланге защиты."
5818,Он дал мне время кончить работу.
5819,"Согласно легенде, кастильский вельможа дон Руис Гонсало де Толедо пожертвовал этой церкви, в которой он пожелал быть погребенным, большие сокровища."
5820,"Тут к нему подошёл боец без погон, назвавшийся старшиной Огрызковым, который, по-видимому, уже имел какой-то парашютный опыт."
5821,С кого он имеет право требовать недостающую сумму и где о нем написано?
5822,"Как утверждают одни ученые, эти игры вредны, как утверждают другие, они полезны."
5823,"Если после столкновения футболист через секунду не вскочил и снова не бросился в бой — значит, у него действительно очень серьезная травма."
5824,"Благодаря стараний всей команды, нам удалось обойти главных конкурентов."
5825,"Совершенно очевидно, что человек отчаянно зануждается в профессиональной консультации и радикальной перемене образа жизни."
5826,"Она расплакалась в присутствии Феди Долгова, благодаря которому в биографии Еки возник период пусть недолгий, но вспоминаемый ею впоследствии с гордостью."
5827,"Интересно оригинальное расположение лёгких ажурных балконов башни, создаваемые «воздушный переход» из одной части дома в другую."
5828,На стене справа висела картина.
5829,"Какого человека, ты говорил, она ударила?"
5830,"Жаль, право, что эти добрые люди так сплетничают; это отнимает всякую охоту ходить к ним."
5831,"Согласно прогнозов синоптиков, весна в этом году будет ранняя."
5832,Ваша организация не выполнила гарантийные обязательства.
5833,"Не хочу знать, кто и зачем его сюда привел."
5834,Камни заваливают вход в ущелье.
5835,Петя Иванов нарочно медленно ест суп.
5836,Он мне только казался.
5837,Разве есть смысл что-либо менять?
5838,"В ту субботу я, окончив дела, как обычно поехала к Игорю."
5839,Он был утешен чем-то.
5840,Преподаватель предложил студенту сократить курсовую работу.
5841,"Отважный смотритель, рискуя жизнью, бросился наперерез понёсшегося вскачь коня."
5842,Я совершенно не представляю себе этого человека.
5843,"Она не унывала, сознавая, что их разлука долго не продлится."
5844,"Я считаю, что ты, несомненно, справишься."
5845,За стеной кашлял человек.
5846,"Лекцию слушали не только внимательно, но и записывали."
5847,Поезд следует из чего?
5848,Появление Пети объяснило мне отсутствие Вани.
5849,У телефона лежала записная книжка.
5850,"Одному из героев романа, ищущим смысл жизни, открывается путь к внутренней свободе."
5851,Я воспринимаю его как своего врага.
5852,"В своём романе «Герой нашего времени» М.Ю. Лермонтов раскрыл индивидуализм Печорина и рассматривает не только его психологию, но и мировоззренческие основы его жизни."
5853,У нас в институте занятия по английскому языку.
5854,У меня есть серые глаза.
5855,Следующий довод опроверг его утверждение.
5856,"Она попросила меня выяснить причины конфликта, самому не вмешиваясь в него."
5857,"Иван подозревает, что его обманывают."
5858,Ее голос стал горькой ноткой.
5859,"В то время как случилось несчастье с Никанором Ивановичем, в кабинете Римского находились двое."
5860,"Он думает, что все знает об этом."
5861,"И однажды он не выдержал, сбрил успевшую отрасти до бородки щетину."
5862,Альфред любит современную музыку.
5863,"Подразделения полка, наступающие по долине, стремятся выйти в тыл противнику, обороняющему высоты, поражая его фланговым огнем своей артиллерии, минометов и пулеметов."
5864,Лоси в нашем лесу не водятся.
5865,Неужели ты до сих пор оскорбляешься?
5866,Пойду и возьму зарплату.
5867,Его не пришлет ответ.
5868,Я сделал ей подарок.
5869,Здесь построили два комбината.
5870,Тебе надо быть неприступной.
5871,"Тот день, как они расстались, был сорок пять лет назад."
5872,"Я не знаю, куда он пошел."
5873,"Коля считает, что защита состоится, скорее всего, в октябре."
5874,"Я стал бояться, как бы он нечаянно не нажал собачку."
5875,Эти студенты — сами специалисты в эскимосском языке.
5876,Ты еще за это поплатишься!
5877,"Иногда ты играешь с ней в одной сцене и не понимаешь, что она делает, пока не посмотришь отснятый материал."
5878,Кто-нибудь из вас мог бы пойти туда.
5879,Все были довольны большой молодцом.
5880,Моя дочь связалась с негодяем.
5881,В два часа меня уже не будет в институте.
5882,"А. И. Куприн не хотел смириться с пошлыми, практическими взглядами на любовь и брак и пишет рассказ «Гранатовый браслет» о настоящей любви."
5883,"Вообще-то он в комнате, но сейчас он вышел."
5884,Ефрем управлял одновременно и Ростовской епархией после смерти в тысячу девяностом году епископа Исайи.
5885,Я выбрал кота среди других котов.
5886,Они не встречали никакого сопротивления на своем пути.
5887,Вани нигде не было.
5888,"Если такой материал уже имеется, то сможете ли вы его дополнить и написать более интереснее существующей статьи?"
5889,"Виной тому, мягко говоря, нестабильная политическая ситуация — в той же Колумбии много лет идет гражданская война, а часть территории страны вообще не контролируется федеральным правительством."
5890,"Отвечая на экзаменационный вопрос, студент сказал: «Большой вклад в нашу устойчивость к болезням вносила эволюция самих возбудителей, направленных на минимизацию вреда хозяину»."
5891,Быть убитому лекаpством – в наше вpемя уже не смешно.
5892,Я не застал Машу у себя.
5893,"Я с автором согласна то, что молодёжь больше увлекается интернетом, чем книгами."
5894,В небе находится неопознанный летающий объект.
5895,"Албанские экстремисты стремятся уничтожить всё, что в Косово и Метохии имеет какие-либо сербские признаки."
5896,Частые припадки его болезни сделали из него совсем почти идиота.
5897,Во вторник крепость была окружена противником.
5898,"Ну, что же, если хотите жить на свободе, идите, я дам вам волю."
5899,"Уважая судебные процедуры государства Катар, наши адвокаты подадут апелляцию с целью пересмотра принятого решения."
5900,"Ассортимент продукции, представленный на нашем сайте, необычайно широк."
5901,"А смерть, которую Олег видел собственными глазами, была обманом."
5902,"Он по жизни, так что эта ситуация тоже не будет исключением, ни на что внимания не обращает."
5903,"Уже дважды приходил участковый и спрашивал, где мой иностранец."
5904,"Хотя у меня возникали некоторые сомнения, он всегда говорил очень убедительно."
5905,Ты обо мне хоть раз вспоминала?
5906,"Увидев поздно ночью свет в окне Александры, мне стало не по себе."
5907,"Можно подумать, что ты этим довольна."
5908,"Когда же герои хотят, чтобы их случайно не подслушали милиционеры на улице, то переходят с фирменно кубинского аглицкого на иностранный французистый."
5909,"Два механизма сплелись в один, образуя подобие низкого колченогого стула, из брюха которого болталась пара лопнутых пружин – боевые манипуляторы."
5910,"Блог писателя — это отдельная часть его жизни, и обычно она по-настоящему интересна тем, кто хорошо знаком с его произведениями."
5911,"А я думал, что он, к счастью, еще здесь."
5912,"Говорят, что он собирается подать в отставку, но это, может быть, и неправда."
5913,Бери какую-нибудь из этих книг.
5914,"Я уверен, что он наверное прав."
5915,Где он дал согласие быть прописанному?
5916,"Вдали грузинские деревни казались прекрасными садами, а вблизи я увидел несколько бедных саклей."
5917,Согласно плана в качестве итоговой работы мы писали рецензию на недавно прочитанную книгу.
5918,"Когда он с кем-то едет в экспедицию, я спокойна."
5919,Пассажиры приглашаются в салон.
5920,Он объясняет начальству свое отсутствие.
5921,Иван принял решение пойти на встречу одному.
5922,Я знаю это от Ивана.
5923,Музей Пастернака есть в Переделкине.
5924,Он когда-то учился в музыкальной школе.
5925,Арбитражный суд согласился под этим выводом.
5926,Прибор научился сам звонить в звоночек.
5927,"Дети в школе на 9 мая рассказывали про своих прадедушек, которые прошли возвращение из плена, много перенеся."
5928,"Давайте посмотрим, как это выглядит с экономической точки зрения."
5929,Он близко наклоняется к ней и с улыбкой говорит ей что-то.
5930,Исходный код программы требовал доработки.
5931,Обещаю тебе прийти в два.
5932,"Вообще он замечательный город, я очень люблю там бывать."
5933,Немного поодаль лежал еще один раненый.
5934,Король Хуссейн не выбрал преемником Хасана.
5935,Туристическая фирма обязана предоставить потребителю информацию о своей государственной регистрации и наименовании зарегистрировавшего её органа.
5936,Ночь была дождливая и темна.
5937,А вы ноктюрн сыграть могли бы?
5938,"Как готов поклясться Иван, изменения необходимы."
5939,Пригласите этого свидетеля принять у него присягу.
5940,"После сурового выговора от отца Нергал получил приказ отправляться в Нижний мир один, вооруженный лишь советами родителя."
5941,Индейцы — общее название коренного населения Америки.
5942,"Ихние дети, Валентин и Ирка, всегда целовали маму Раю, если приходили в гости."
5943,"Вообще-то я сейчас работаю над проектом, но сегодня я решил немного отвлечься."
5944,"Чтобы человеку, владеющему иностранным языком, научиться свободно общаться с носителями этого языка, ему необходимо преодолеть языковой барьер."
5945,Он дал мне некоторое представление о случившемся.
5946,Она неправильно приняла это известие.
5947,Поодалъ от сломанной коробочки лежала ее крышка.
5948,Он выбирает из двух зол меньшее.
5949,Иван нарушил обещание встретиться с нами самому.
5950,"Боюсь, мне не хватит на это времени."
5951,Бензин кончился у села Покров.
5952,"С этих пор на их дом опустилась тайна, то есть тишина."
5953,Она уже задумывается о будущем.
5954,Она одевается со вкусом.
5955,На Политбюро 17 октября 1987 года Горбачев снова и весьма определенно высказался на эту тему.
5956,Ты взяла мне одну бутылку молока или две?
5957,Окна смотрят на юг.
5958,"Сомневаюсь, чтобы не выданные Жанне деньги возвратились в казну."
5959,"Брат надеется на то, что поступит в университет."
5960,"Я не принимаю, что я вел себя непорядочно."
5961,"По приезду в санаторий мы тут же созвонились с родными, сообщив приятную новость."
5962,Он схватил ее в объятия.
5963,Он мне посветил фонариком.
5964,"Возьми с меня плед, мне жарко."
5965,"Мне хотелось сказать огромное спасибо композитору за музыку, который написал это чудесное, по-настоящему гениальное произведение."
5966,"Между тем из здания выбежали солдаты, приказ которым выдвигаться на позицию отдал командир."
5967,Я отдал книгу Ивану газету.
5968,Она быстро усвоила его приемы работы на станке.
5969,В зале есть иностранцы.
5970,Это известие лишает меня сна.
5971,Он дал мне пощечину.
5972,Князь Андрей в своем стремлении к духовному совершенству совершает немало ошибок и осуждал себя за них гораздо больше других.
5973,"Слезливый гуманизм знаком каждому, а нам нужен реальный, помогающий и поддерживающий."
5974,"Он молча посмотрел на нее, как будто что-нибудь взвешивая."
5975,"Надо всем стоял, как гора, роковой и неразрешимый вопрос: чем кончится у отца с братом Дмитрием пред этою страшною женщиной?"
5976,"Согласно действующим в торговле правилам, по истечению срока годности продукты должны быть сняты с продажи."
5977,"Тут рядом с нами есть деревушка Глебово, вот туда мы и будем ходить, там такие хорошие горки."
5978,Студентов первого курса включили в список?
5979,"Видно было, что по ней давно уже не ходили люди."
5980,На это обстоятельство кое-кем намекалось.
5981,"И я размышлял о том, что все, что сейчас происходит, что тянется так мучительно, все получит свое завершение."
5982,"Он встал, медленно, с нарочито-печальным, покаянным лицом надел пальто, взял котомку."
5983,"Вполне можно ожидать, что результаты этой мыслительной деятельности кремлевских экспертов окажутся, мягко говоря, нестандартными."
5984,"И вручил мне обещанную купюру, которая позволила нам всю неделю мазать масло на хлеб."
5985,Она грела руки рядом с батареей.
5986,Этот на был очень тяжелым.
5987,Вчера я смогла весь день работать.
5988,"Я согласен с вашим советом, но, к сожалению, не могу им воспользоваться."
5989,Я не обещаю вернуться.
5990,Записку и веточку она положила около него.
5991,Половина детей были больная.
5992,"Он сейчас не спит на диване, а сидит за компьютером."
5993,Иногда к ней приходит кто-нибудь из ее друзей.
5994,"Куда, ты говоришь, он девался?"
5995,"Подъезжая к сией станции и глядя на природу в окно, у меня слетела шляпа."
5996,"Увидал, что у санитара нет сапог ― велел дать."
5997,Около постели стояла зажженная свеча.
5998,Наше войско дружным нападением решило дело.
5999,Кто находил этот кошелек?
6000,"Обвинив во всем сотрудниц, он одну уволил, а другой объявил выговор."
6001,"Просто так народ не будет не любить, это же очевидно."
6002,Я особенно не удивился.
6003,Современная молодежь для физического самосовершенствования выбирают фитнесцентры по месту.
6004,Прямая и отрезок пересекаются.
6005,По возвращению в Петербург Толя отказался ехать домой сразу из аэропорта.
6006,"У нас есть лозунг ""За здорового советского старика!"""
6007,У въезда в город стояла разбитая машина.
6008,Эти препараты сейчас нашлись.
6009,Мы не получили письмо.
6010,"Подожди, я заканчиваю письмо."
6011,"В саду и в комнате было так тихо, что слышалось, как за окном быстро прошумит крыльями ласточка."
6012,Обязательным требованием для получения диплома о высшем образовании является прохождение производственной практики.
6013,После ее слов у меня опять появилась надежда.
6014,"Я уверен, что он несомненно прав."
6015,Я не разбивал чашки.
6016,Твои книги мне не нужны.
6017,Возникшее чувство вины увеличило ее страдания.
6018,"Я видел по телевизору ""Галатею""."
6019,"Пишите рассказы, встречайте поезда дальнего следования, смейтесь, сочувствуйте страждущим."
6020,В отдалении показался человек.
6021,"Никогда не знавшая семейного уюта Алена пригрелась возле Нины Карповны, как бездомный котенок."
6022,Никому не было холодно.
6023,"Он вспомнил, как ее зовут."
6024,Я не читаю газет.
6025,"Руководитель серьёзного проекта, в котором принимают участие сотни людей, должен быть глубокой и цельной личностью."
6026,"Те, кто с лёгкостью осваивает материал, вынужден ждать, пока с ним справятся отстающие."
